{
  "benchmark": "aider-polyglot",
  "runs": 3,
  "task": ["python/leap", "go/leap", "rust/leap"],
  "candidates": [
    {
      "name": "claude-sonnet-anthropic-api",
      "backend": "claude-code",
      "model": "sonnet"
    },
    {
      "name": "claude-opus-anthropic-api",
      "backend": "claude-code",
      "model": "opus"
    },
    {
      "name": "llama3-70b-via-vllm",
      "backend": "claude-code",
      "model": "meta-llama/Llama-3-70B-Instruct",
      "env": {
        "ANTHROPIC_BASE_URL": "http://localhost:8000",
        "ANTHROPIC_AUTH_TOKEN": "dummy-vllm-does-not-check",
        "ANTHROPIC_DEFAULT_SONNET_MODEL": "meta-llama/Llama-3-70B-Instruct"
      }
    },
    {
      "name": "qwen-coder-via-ollama",
      "backend": "claude-code",
      "model": "qwen2.5-coder:32b",
      "env": {
        "ANTHROPIC_BASE_URL": "http://localhost:11434",
        "ANTHROPIC_AUTH_TOKEN": "dummy",
        "ANTHROPIC_DEFAULT_SONNET_MODEL": "qwen2.5-coder:32b"
      }
    }
  ]
}
